{
  "version": 4,
  "output": "Pielikums.pdf",
  "page_defaults": {
    "background": "#F4EFE6",
    "text": {
      "size": 20,
      "leading": 1.5
    }
  },
  "items": [
    {
      "source": "01.pdf"
    },
    {
      "page": {
        "text": {
          "value": "Pielikums\nĀ ļ ķ š ž, ā ļ; Ελληνικά; Кириллица"
        }
      }
    },
    {
      "source": "02.pdf"
    }
  ]
}
